{
  "schema_version": "1.1",
  "enabled": true,
  "policy_level": "comparative",
  "design_version": 1,
  "design_status": "draft",
  "research_question": "Can the two hypotheses be told apart by evidence?",
  "primary_hypothesis": {
    "id": "H1",
    "statement": "The overlap reflects internal continuity.",
    "risk_bearing": true,
    "failure_effect": "The continuity claim is retracted.",
    "predictions": [
      {
        "evidence_class": "source_texts",
        "expected_observation": "The later text reuses the earlier vocabulary."
      }
    ]
  },
  "rival_hypotheses": [
    {
      "id": "H2",
      "statement": "The same evidence would be explained by the rival account.",
      "hypothesis_kind": "other",
      "simplicity_note": "Claims equal simplicity.",
      "predictions": [
        {
          "evidence_class": "source_texts",
          "expected_observation": "The later text reuses the earlier vocabulary."
        }
      ]
    }
  ],
  "falsification_conditions": [
    {
      "id": "F1",
      "statement": "If all discriminating predictions fail, H1 is not supported.",
      "related_hypothesis_id": "H1"
    }
  ],
  "operational_criteria": [
    {
      "id": "C1",
      "statement": "Structural correspondence is established by shared vocabulary and function.",
      "inclusion_test": "Both texts contain the same term with a comparable role.",
      "exclusion_test": "Shared vocabulary without comparable role is not counted."
    }
  ],
  "diachronic_connection_evidence": [],
  "mechanism_chain": [],
  "mechanism_failure_conditions": [],
  "materials": [],
  "holdout_sources": [],
  "negative_controls": [
    {
      "id": "NC1",
      "source_ref": "control-a",
      "reason_for_control": "Controls the same standard.",
      "expected_result": "Fails the criteria.",
      "same_standard_as_primary": true,
      "actual_result": "fails",
      "tests_hypotheses": [
        "H2"
      ]
    }
  ],
  "outcome_branches": {
    "primary_supported": {
      "conclusion_effect": "Continuity is kept.",
      "retracts_primary": false,
      "changes_contribution": false,
      "changes_center_conclusion": false
    },
    "rival_supported": {
      "conclusion_effect": "Continuity is retracted.",
      "retracts_primary": true,
      "changes_contribution": true,
      "changes_center_conclusion": true
    }
  },
  "contribution_type": {
    "primary": "conceptual_reconstruction",
    "secondary": []
  },
  "bridge_assessments": [],
  "adversarial_review": {
    "status": "pending",
    "path": null,
    "completed_at": null
  },
  "validation_status": {
    "required": false,
    "completed": false,
    "completed_at": null
  },
  "design_history": []
}
