{
  "schema_version": "1.1",
  "enabled": true,
  "policy_level": "genealogical",
  "design_version": 1,
  "design_status": "draft",
  "research_question": "Is the structural similarity evidence of internal intellectual continuity?",
  "primary_hypothesis": {
    "id": "H1",
    "statement": "The observed structural overlap reflects internal continuity in the author's problem development.",
    "risk_bearing": true,
    "failure_effect": "The continuity claim in the center conclusion must be retracted.",
    "predictions": [
      {
        "evidence_class": "source_texts",
        "expected_observation": "The later text explicitly reuses the earlier problem vocabulary with the same function."
      }
    ]
  },
  "rival_hypotheses": [
    {
      "id": "H2",
      "statement": "Both texts draw independently on a shared resource.",
      "hypothesis_kind": "shared_source",
      "simplicity_note": "Simpler when no direct authorial linkage is documented.",
      "predictions": [
        {
          "evidence_class": "source_texts",
          "expected_observation": "The same vocabulary appears in unrelated authors."
        }
      ]
    },
    {
      "id": "H3",
      "statement": "The similarity is a template artifact.",
      "hypothesis_kind": "template_too_broad",
      "simplicity_note": "Requires no biographical assumption.",
      "predictions": [
        {
          "evidence_class": "source_texts",
          "expected_observation": "Unrelated pairs pass the same template."
        }
      ]
    }
  ],
  "falsification_conditions": [
    {
      "id": "F1",
      "statement": "If all discriminating predictions fail, H1 is not supported.",
      "related_hypothesis_id": "H1"
    }
  ],
  "operational_criteria": [
    {
      "id": "C1",
      "statement": "Structural correspondence is established by shared vocabulary and function.",
      "inclusion_test": "Both texts contain the same term with a comparable role.",
      "exclusion_test": "Shared vocabulary without comparable role is not counted."
    }
  ],
  "diachronic_connection_evidence": [],
  "mechanism_chain": [],
  "mechanism_failure_conditions": [],
  "materials": [
    {
      "id": "M1",
      "source_ref": "early-works",
      "evidence_role": "validation",
      "seen_before_lock": true,
      "design_impacted": false
    },
    {
      "id": "M2",
      "source_ref": "holdout-letter",
      "evidence_role": "holdout",
      "seen_before_lock": true,
      "design_impacted": false
    }
  ],
  "holdout_sources": [],
  "negative_controls": [
    {
      "id": "NC1",
      "source_ref": "control-a",
      "reason_for_control": "Controls the same standard.",
      "expected_result": "Fails the criteria.",
      "same_standard_as_primary": true,
      "actual_result": "fails",
      "tests_hypotheses": [
        "H3"
      ]
    }
  ],
  "outcome_branches": {
    "primary_supported": {
      "conclusion_effect": "The continuity claim is kept.",
      "retracts_primary": false,
      "changes_contribution": false,
      "changes_center_conclusion": false
    },
    "rival_supported": {
      "conclusion_effect": "The continuity claim is retracted and only shared-resource use is reported.",
      "retracts_primary": true,
      "changes_contribution": true,
      "changes_center_conclusion": true
    }
  },
  "contribution_type": {
    "primary": "dispute_adjudication",
    "secondary": [
      "conceptual_reconstruction"
    ]
  },
  "bridge_assessments": [],
  "adversarial_review": {
    "status": "pending",
    "path": null,
    "completed_at": null
  },
  "validation_status": {
    "required": false,
    "completed": false,
    "completed_at": null
  },
  "design_history": []
}
